{
  "bytePolicy": {
    "constraints": [
      "A header match returns the stable probe-only code and never decoded pixels or a NormalizedImage."
    ],
    "decoderAllowed": false,
    "encoderAllowed": false,
    "maxByteLength": 1048576,
    "maxHeight": null,
    "maxWidth": null,
    "probeKind": "signature-only",
    "signatureLabels": [
      "RIFF plus WEBP form type"
    ]
  },
  "claimBoundary": "Only RIFF/WEBP header probing is permitted; no decode, normalization, ability calibration, or product support follows from a WebP match.",
  "direction": "input",
  "evidenceState": "none",
  "extensions": [
    "webp"
  ],
  "formatId": "webp",
  "formatProfileId": "format-profile.input.webp-probe.v0.3.0",
  "frozenAt": "2026-08-14T19:47:13.000Z",
  "implementationState": "probe-only",
  "mediaTypes": [
    "image/webp"
  ],
  "policyState": "research-candidate",
  "productSupport": false,
  "profileHash": "51b4513f4c6331d6f1c7f612dfca7713ce01b6b45a09ef1f2d0db5d204ea2069",
  "profileVersion": "0.3.0",
  "rejectionCode": "S03_INPUT_WEBP_PROBE_ONLY",
  "schemaVersion": "slice03-format-profile.v0"
}
